vendor_id,vendor_name,question_id,category,question,answer,details
VENDOR_ABC,ABC AI Services,Q1,Data Security,Do you encrypt data at rest?,Yes,AES-256 encryption
VENDOR_ABC,ABC AI Services,Q2,Data Security,Do you encrypt data in transit?,Yes,TLS 1.2
VENDOR_ABC,ABC AI Services,Q3,Access Control,Is Multi-Factor Authentication (MFA) enforced for all users?,Yes,MFA enabled for all admin and internal users
VENDOR_ABC,ABC AI Services,Q4,Access Control,How often are access rights reviewed?,Quarterly,
VENDOR_ABC,ABC AI Services,Q5,Incident Response,Do you have an incident response plan?,Yes,Dedicated security team monitors incidents
VENDOR_ABC,ABC AI Services,Q6,Incident Response,What is your breach notification timeline?,Within 72 hours,
VENDOR_ABC,ABC AI Services,Q7,Data Retention,What is your data retention policy?,30 days,Data deleted after retention period
VENDOR_ABC,ABC AI Services,Q8,Compliance,Which certifications do you hold?,ISO 27001; SOC 2 Type II,
